{
  "id": "default-v0",
  "description": "The whole medium as built in V0: every primitive, every macro, no group blend, one asset pack. Episodes that want a narrower medium should ship their own profile rather than edit this one, since the profile hash is part of what a program means.",
  "primitives": ["wash", "paint", "stroke", "fragment", "text", "rule", "cover"],
  "macros": ["frame", "motif", "quarantine"],
  "layouts": ["grid", "ring", "line", "scatter"],
  "styles": ["wash", "hatch", "field", "outline", "solid"],
  "fonts": ["grotesque", "serif"],
  "brushes": ["pen", "rotring", "2B", "HB", "2H", "cpencil", "pastel", "crayon", "charcoal", "spray", "marker"],
  "blendModes": [],
  "assetPacks": ["core"],
  "limits": {
    "maxSourceNodes": 300,
    "maxResolvedNodes": 1200,
    "maxTreeDepth": 8,
    "maxRepeatInstances": 400,
    "maxRepeatNesting": 2,
    "maxPolygonPoints": 80,
    "maxStrokePoints": 120,
    "maxFragments": 40,
    "maxTextOps": 12,
    "maxTextLength": 240,
    "maxEstimatedMarks": 60000,
    "maxRenderCost": 240000
  },
  "ranges": {
    "x": [-2000, 4000],
    "y": [-2000, 4000],
    "cx": [-2000, 4000],
    "cy": [-2000, 4000],
    "w": [0.5, 4000],
    "h": [0.5, 4000],
    "r": [0.5, 4000],
    "size": [6, 300],
    "scale": [0.05, 8],
    "span": [1, 4000],
    "weight": [0.1, 12],
    "spacing": [1.5, 40],
    "density": [0.05, 20],
    "length": [0, 120],
    "maxWidth": [20, 4000]
  },
  "quantize": {
    "width": 1,
    "height": 1,
    "brushScale": 0.25,
    "seed": 1,
    "seedOffset": 1,
    "x": 0.5,
    "y": 0.5,
    "w": 0.5,
    "h": 0.5,
    "cx": 0.5,
    "cy": 0.5,
    "r": 0.5,
    "dx": 0.5,
    "dy": 0.5,
    "inset": 0.5,
    "arm": 0.5,
    "dotRadius": 0.5,
    "origin": 0.5,
    "translate": 0.5,
    "points": 0.5,
    "from": 0.5,
    "to": 0.5,
    "rotate": 1,
    "angle": 1,
    "startAngle": 1,
    "scale": 0.01,
    "span": 0.5,
    "count": 1,
    "cols": 1,
    "layers": 1,
    "opacity": 1,
    "bleed": 0.01,
    "softness": 0.01,
    "rand": 0.01,
    "curve": 0.01,
    "texture": 0.05,
    "spacing": 0.5,
    "density": 0.05,
    "length": 0.5,
    "jitter": 0.5,
    "weight": 0.1,
    "boxWeight": 0.1,
    "size": 0.5,
    "labelSize": 0.5,
    "tracking": 0.05,
    "labelTracking": 0.05,
    "maxWidth": 1
  }
}
